Title,Category,Link,Date,Author,Description,Polarity
Musk tells Ark that audits could solve Bitcoin’s energy concerns ,Bitcoin ,https://www.moneyweb.co.za/moneyweb-crypto/bitcoin/musk-tells-ark-that-audits-could-solve-bitcoins-energy-concerns/,21 May 2021 / ,"Nathan Crooks, Bloomberg",'This question is easily resolved if the top 10 hashing orgs just post audited numbers of renewable energy vs not.' ,Positive
Bitcoin claws back to $40 000 after crypto market meltdown ,Bitcoin ,https://www.moneyweb.co.za/moneyweb-crypto/bitcoin/bitcoin-claws-back-to-40-000-after-crypto-market-meltdown/,20 May 2021 / ,"Joanna Ossinger, Bloomberg",Markets are showing signs of recovery after Wednesday’s dramatic selloff. ,Negative
"Bitcoin whipsaws investors with same-day plunge, rally of 30% ",Bitcoin ,https://www.moneyweb.co.za/moneyweb-crypto/bitcoin/bitcoin-whipsaws-investors-with-same-day-plunge-rally-of-30/,20 May 2021 / ,"Vildana Hajric, Bloomberg",A 31% plunge in the morning. A 33% surge in the afternoon. ,Neutral
Tesla loses nearly $300bn in market cap since January ,Bitcoin ,https://www.moneyweb.co.za/moneyweb-crypto/bitcoin/tesla-loses-nearly-300bn-in-market-cap-since-january/,20 May 2021 / ,"Esha Dey, Bloomberg","Shares in the Elon Musk-led company closed down 2.5% at $563.46, the lowest since March 8. ",Negative
Bitcoin plunges to $38 000 ,Bitcoin ,https://www.moneyweb.co.za/moneyweb-crypto/bitcoin/bitcoin-plunges-to-38-000/,19 May 2021 / ,"Vildana Hajric and Joanna Ossinger, Bloomberg", As Elon Musk-fueled rally collapses. ,Neutral
Bitcoin’s obstacles mount amid China cryptocurrency warning ,Bitcoin ,https://www.moneyweb.co.za/moneyweb-crypto/bitcoin/bitcoins-obstacles-mount-amid-china-cryptocurrency-warning/,19 May 2021 / ,Ciaran Ryan,People’s Bank of China conveyed a statement reiterating that digital tokens can’t be used as a form of payment. ,Neutral
Elon Musk causes panic rush for exit door by bitcoin newcomers ,Bitcoin ,https://www.moneyweb.co.za/moneyweb-crypto/elon-musk-causes-panic-rush-for-exit-door-by-bitcoin-newcomers/,19 May 2021 / ,"Joanna Ossinger, Bloomberg",But old-timers have seen this movie before and are going nowhere. ,Neutral
Musk fuels Bitcoin volatility by saying Tesla hasn’t sold stake ,Bitcoin ,https://www.moneyweb.co.za/moneyweb-crypto/bitcoin/musk-fuels-bitcoin-volatility-by-saying-tesla-hasnt-sold-stake/,17 May 2021 / ,"Claire Ballentine, Bloomberg","For a second week, the crypto market is being ruled by tweets from billionaire Elon Musk. ",Neutral
Crypto fund Pantera says bitcoin energy concern to impact market ,Bitcoin ,https://www.moneyweb.co.za/moneyweb-crypto/bitcoin/crypto-fund-pantera-says-bitcoin-energy-concern-to-impact-market/,15 May 2021 / ,Ciaran Ryan,The largest cryptocurrency plunged on Thursday in the wake of Musk’s comments about bitcoin’s energy use. ,Neutral
Elon Musk ignites climate debate over bitcoin ,Bitcoin ,https://www.moneyweb.co.za/moneyweb-crypto/bitcoin/elon-musk-ignites-climate-debate-over-bitcoin/,14 May 2021 / ,"Brandon Kochkodin, Bloomberg",And hints Tesla might adopt more energy-efficient cryptocurrencies. ,Positive
Roaring crypto cacophony drowns out rest of Wall Street ,Bitcoin ,https://www.moneyweb.co.za/moneyweb-crypto/bitcoin/roaring-crypto-cacophony-drowns-out-rest-of-wall-street/,14 May 2021 / ,"Gearoid Reidy and Joe Easton, Bloomberg","If you really want to get people’s attention right now, you need to tell them a story about crypto. ",Positive
Musk’s Bitcoin concerns sink crypto-linked stocks ,Bitcoin ,https://www.moneyweb.co.za/moneyweb-crypto/bitcoin/musks-bitcoin-concerns-sink-crypto-linked-stocks/,14 May 2021 / ,"Joe Weisenthal, Bloomberg","Crypto shares from the US to Asia slid as Bitcoin plunged as much as 15%, sinking to a low of $46 045 before trimming the decline. ",Positive
Bitcoin isn’t behaving as an inflation hedge ,Bitcoin ,https://www.moneyweb.co.za/moneyweb-crypto/bitcoin/bitcoin-isnt-behaving-as-an-inflation-hedge/,13 May 2021 / ,"Dana Hull and Dave Liedtka, Bloomberg",Its move still makes sense. ,Neutral
Musk sends Bitcoin tumbling with shock u-turn on payments ,Bitcoin ,https://www.moneyweb.co.za/moneyweb-crypto/bitcoin/musk-sends-bitcoin-tumbling-with-shock-u-turn-on-payments/,13 May 2021 / ,"Joe Weisenthal, Bloomberg",The electric-vehicle manufacturer is suspending purchases using Bitcoin. ,Neutral
The difference between a Memecoin and a Memestock ,Bitcoin ,https://www.moneyweb.co.za/moneyweb-crypto/bitcoin/the-difference-between-a-memecoin-and-a-memestock/,12 May 2021 / ,"Yakob Peterseil, Bloomberg","By now, everyone has become familiar with meme-assets. ",Positive
Dogecoin spikes after Musk asks whether Tesla should accept it ,Bitcoin ,https://www.moneyweb.co.za/moneyweb-crypto/bitcoin/dogecoin-spikes-after-musk-asks-whether-tesla-should-accept-it/,11 May 2021 / ,Ciaran Ryan,"The token jumped from around 46 cents to as high as 54 cents after Musk’s tweet, according to Coinmarketcap.com ",Positive
Bitcoin surrenders market dominance ,Bitcoin ,https://www.moneyweb.co.za/moneyweb-crypto/bitcoin/bitcoin-surrenders-market-dominance/,11 May 2021 / ,"Joanna Ossinger, Bloomberg",As investor interest rotates to Ethereum and riskier altcoins.  ,Neutral
Ether’s 1 500% jump is just the start for the crypto faithful ,Bitcoin ,https://www.moneyweb.co.za/moneyweb-crypto/bitcoin/ethers-1-500-jump-is-just-the-start-for-the-crypto-faithful/,4 May 2021 / ,"Joanna Ossinger, Bloomberg",Ether rose 2.5% to $3 366 as of 8:18 a.m. in London. ,Positive
"Bitcoin is facing a make-or-break moment, technicals show ",Bitcoin ,https://www.moneyweb.co.za/moneyweb-crypto/bitcoin/bitcoin-is-facing-a-make-or-break-moment-technicals-show/,29 Apr 2021 / ,"Vildana Hajric and Lu Wang, Bloomberg","Following a recent bout of selling, according to technical analysis. ",Neutral
Crypto wunderkind’s tokens surge to top of best-performing list ,Bitcoin ,https://www.moneyweb.co.za/moneyweb-crypto/bitcoin/crypto-wunderkinds-tokens-surge-to-top-of-best-performing-list/,28 Apr 2021 / ,"Olga Kharif, Bloomberg"," 'Solana is a promising competitor in a crowded space,' said crypto investor Aaron Brown ",Positive
Bitcoin bounces strongly after hitting lowest since early March ,Bitcoin ,https://www.moneyweb.co.za/news-fast-news/bitcoin-bounces-strongly-after-hitting-lowest-since-early-march/,26 Apr 2021 / ,Bloomberg News ,World's largest crypto rallies after dropping to the lowest level in seven weeks. ,Neutral
Turkey arrests dozens in probe of crypto exchange collapse ,Bitcoin ,https://www.moneyweb.co.za/moneyweb-crypto/bitcoin/turkey-arrests-dozens-in-probe-of-crypto-exchange-collapse/,23 Apr 2021 / ,"Onur Ant, Bloomberg","Security forces detained 62 people in eight cities including Istanbul, where the Thodex exchange was based. ",Neutral
Turkish crypto exchange goes bust as founder flees country ,Bitcoin ,https://www.moneyweb.co.za/news-fast-news/turkish-crypto-exchange-goes-bust-as-founder-flees-country/,23 Apr 2021 / ,"Taylan Bilgic and Firat Kozok, Bloomberg",Leaving hundreds of thousands of investors fearing their savings have evaporated as authorities sought to locate the company’s 27-year-old founder. ,Neutral
Bitcoin drops below $50 000 ,Bitcoin ,https://www.moneyweb.co.za/moneyweb-crypto/bitcoin/bitcoin-drops-below-50-000/,23 Apr 2021 / ,"Vildana Hajric and Joanna Ossinger, Bloomberg",Amid tax and momentum concerns. ,Neutral
Steynbergs of MTI provisionally sequestrated ,Bitcoin ,https://www.moneyweb.co.za/moneyweb-crypto/bitcoin/steynbergs-of-mti-provisionally-sequestrated/,23 Apr 2021 / ,Ciaran Ryan,And still no sight of the missing CEO. ,Negative
Wall Street starts to see weakness emerge in bitcoin charts ,Bitcoin ,https://www.moneyweb.co.za/moneyweb-crypto/bitcoin/wall-street-starts-to-see-weakness-emerge-in-bitcoin-charts/,22 Apr 2021 / ,"Joanna Ossinger and Vildana Hajric, Bloomberg",Enter the chart watchers. ,Neutral
Dogecoin retreats after topping Ford and Kraft in market value ,Bitcoin ,https://www.moneyweb.co.za/moneyweb-crypto/bitcoin/dogecoin-retreats-after-topping-ford-and-kraft-in-market-value/,21 Apr 2021 / ,"Yakob Peterseil, Bloomberg","For a cryptocurrency created as a joke, Dogecoin finds itself in some serious company. ",Negative
Dogecoin rips in meme-fueled frenzy as biggest cryptos struggle ,Bitcoin ,https://www.moneyweb.co.za/moneyweb-crypto/bitcoin/dogecoin-rips-in-meme-fueled-frenzy-as-biggest-cryptos-struggle/,20 Apr 2021 / ,"Joanna Ossinger, Bloomberg",Fans are driving Dogecoin higher to mark an auspicious day. ,Positive
Coinbase hangover rattles crypto assets with bitcoin falling ,Bitcoin ,https://www.moneyweb.co.za/moneyweb-crypto/bitcoin/coinbase-hangover-rattles-crypto-assets-with-bitcoin-falling/,19 Apr 2021 / ,"Shamim Adam and Emily Barrett, Bloomberg ",World's biggest crypto drops the most since February. ,Positive
Bitcoin-ETF frenzy heats up with grayscale deal ,Bitcoin ,https://www.moneyweb.co.za/moneyweb-crypto/bitcoin/bitcoin-etf-frenzy-heats-up-with-grayscale-deal/,16 Apr 2021 / ,"Nick Baker, Bloomberg ",Ticker change. ,Neutral
Why regulation is essential for mass adoption of cryptos ,Bitcoin ,https://www.moneyweb.co.za/moneyweb-crypto/bitcoin/why-regulation-is-essential-for-mass-adoption-of-cryptos/,16 Apr 2021 / ,Wiehann Olivier,It will help build the trust that reputable crypto operators are seeking – and help prevent the next MTI scam. ,Positive
R1m bitcoin now within sight ,Bitcoin ,https://www.moneyweb.co.za/moneyweb-crypto/bitcoin/r1m-bitcoin-now-within-sight/,15 Apr 2021 / ,Ciaran Ryan,It was trading at just R2 450 six years ago. ,Neutral
Coinbase selloff after trading debut spills into bitcoin rally ,Bitcoin ,https://www.moneyweb.co.za/moneyweb-crypto/bitcoin/coinbase-selloff-after-trading-debut-spills-into-bitcoin-rally/,15 Apr 2021 / ,"Yakob Peterseil, Bloomberg",Bitcoin pulled back from an all-time high as the biggest US crypto exchange tumbled to close down 14%. ,Positive
Bitcoin touches $64 000 high ,Bitcoin ,https://www.moneyweb.co.za/moneyweb-crypto/bitcoin/bitcoin-touches-64-000-high/,14 Apr 2021 / ,"Eric Lam and Yakob Peterseil, Bloomberg",As traders eye Coinbase listing. ,Neutral
Bitcoin rallies to all-time high as traders eye Coinbase listing ,Bitcoin ,https://www.moneyweb.co.za/moneyweb-crypto/bitcoin/bitcoin-rallies-to-all-time-high-as-traders-eye-coinbase-listing/,13 Apr 2021 / ,"Eric Lam and Yakob Peterseil, Bloomberg","The token rose as much as 4.3% to $62 531, exceeding the previous peak in March. ",Positive
Bitcoin nears record before largest US crypto exchange listing ,Bitcoin ,https://www.moneyweb.co.za/moneyweb-crypto/bitcoin/bitcoin-nears-record-before-largest-us-crypto-exchange-listing/,12 Apr 2021 / ,"Joanna Ossinger, Bloomberg",The token rose as much as 2.6% to $61 229. ,Positive
Crypto lobby forms to shake reputation as criminals’ currency ,Bitcoin ,https://www.moneyweb.co.za/moneyweb-crypto/bitcoin/crypto-lobby-forms-to-shake-reputation-as-criminals-currency/,11 Apr 2021 / ,"Joe Light, Bloomberg",Posing a challenge to the nascent industry as it seeks to win wider respect. ,Positive
Anatomy of a bitcoin scam that’s hit at least four South Africans ,Bitcoin ,https://www.moneyweb.co.za/moneyweb-crypto/bitcoin/anatomy-of-a-bitcoin-scam-thats-hit-at-least-four-south-africans/,6 Apr 2021 / ,Ciaran Ryan,"TJ Naidoo of Durban got pulled into a bitcoin scam on Facebook. It started small, then quickly spiralled out of control. ",Positive
A 33-year-old fuelling crypto boom is worrying Thai regulators ,Bitcoin ,https://www.moneyweb.co.za/news-fast-news/a-33-year-old-fuelling-crypto-boom-is-worrying-thai-regulators/,5 Apr 2021 / ,"Anuchit Nguyen, Bloomberg ",As price of cryptocurrencies continues to rise.  ,Neutral
MTI liquidators recover R1.1bn in bitcoin ,Bitcoin ,https://www.moneyweb.co.za/moneyweb-crypto/bitcoin/mti-liquidators-recover-r1-1-billion-in-bitcoin/,1 Apr 2021 / ,Ciaran Ryan,With a 'high likelihood' of recovering more. ,Positive
Goldman close to offering bitcoin to wealth management clients ,Bitcoin ,https://www.moneyweb.co.za/news-fast-news/goldman-close-to-offering-bitcoin-to-wealth-management-clients/,1 Apr 2021 / ,"Daniel Taub and Charlie Wells, Reuters",As the crypto's rally over the past few months has intrigued wealthy investors in a new way. ,Positive
PayPal launches crypto checkout service ,Bitcoin ,https://www.moneyweb.co.za/moneyweb-crypto/bitcoin/paypal-launches-crypto-checkout-service/,31 Mar 2021 / ,Anna Irrera,A move that could significantly boost use of digital assets in everyday commerce. ,Positive
"Britain will focus crypto rules on stablecoins, minister says ",Bitcoin ,https://www.moneyweb.co.za/moneyweb-crypto/bitcoin/britain-will-focus-crypto-rules-on-stablecoins-minister-says/,31 Mar 2021 / ,"Huw Jones and Tom Wilson, Reuters",Rather than the broader cryptocurrency market. ,Neutral
Bitcoin slips in another sign that retail trader mania is fading ,Bitcoin ,https://www.moneyweb.co.za/moneyweb-crypto/bitcoin/bitcoin-slips-in-another-sign-that-retail-trader-mania-is-fading/,25 Mar 2021 / ,"Eric Lam, Bloomberg",The token is mired in its longest losing streak since December. ,Neutral
"Tesla starts accepting bitcoin as payment for cars, Musk says ",Bitcoin ,https://www.moneyweb.co.za/moneyweb-crypto/bitcoin/tesla-starts-accepting-bitcoin-as-payment-for-cars-musk-says/,24 Mar 2021 / ,Bloomberg News ,And that paying by bitcoin will also be available to customers outside the US later this year. ,Positive
Bitcoin’s next big move ,Bitcoin ,https://www.moneyweb.co.za/moneyweb-crypto/bitcoins-next-big-move/,23 Mar 2021 / ,Ciaran Ryan,From store of value to global payments system – Citibank. ,Neutral
SA firms start investing their cash in bitcoin ,Bitcoin ,https://www.moneyweb.co.za/moneyweb-crypto/bitcoin/sa-firms-start-investing-their-cash-in-bitcoin/,18 Mar 2021 / ,Duncan McLeod,Industry players expect the trend to accelerate — and quickly. ,Positive
Wall street steps up crypto ETF push ,Bitcoin ,https://www.moneyweb.co.za/moneyweb-crypto/bitcoin/wall-street-steps-up-crypto-etf-push/,17 Mar 2021 / ,"Claire Ballentine and Olivia Raimonde, Bloomberg",As SEC verdict unknown. ,Negative
Bitcoin losses accelerate after weekend rally to record high ,Bitcoin ,https://www.moneyweb.co.za/moneyweb-crypto/bitcoin/bitcoin-losses-accelerate-after-weekend-rally-to-record-high/,16 Mar 2021 / ,"Eric Lam, Bloomberg ",Retreats below its 10-day moving average. ,Negative
Bitcoin extends drop after weekend rally to record above $61 000 ,Bitcoin ,https://www.moneyweb.co.za/moneyweb-crypto/bitcoin/bitcoin-extends-drop-after-weekend-rally-to-record-above-61-000/,15 Mar 2021 / ,"Joanna Ossinger, Bloomberg","The largest cryptocurrency was trading at $55 326 as of 9:51 a.m. in London, after topping out at $61 742 on Saturday. ",Neutral
Bitcoin dips from record after scaling $61 000 aided by stimulus ,Bitcoin ,https://www.moneyweb.co.za/moneyweb-crypto/bitcoin/bitcoin-dips-from-record-after-scaling-61-000-aided-by-stimulus/,15 Mar 2021 / ,"Joanna Ossinger, Bloomberg ","The cryptocurrency keeps scaling new highs, leaving crypto skeptics agog. ",Positive
Bitcoin approaches record high as risk-on rally accelerates ,Bitcoin ,https://www.moneyweb.co.za/news-fast-news/bitcoin-approaches-record-high-as-risk-on-rally-accelerates/,12 Mar 2021 / ,"Joanna Ossinger and Eric Lam, Bloomberg",World's largest crypto bounces back. ,Neutral
Bitcoin breaks through $55 000 ,Bitcoin ,https://www.moneyweb.co.za/moneyweb-crypto/bitcoin/bitcoin-breaks-through-55-000/,10 Mar 2021 / ,"Loni Prinsloo and Roxanne Henderson, Bloomberg",As risk appetite revives. ,Neutral
Crypto havens lure firms fleeing regulator angst in SA ,Bitcoin ,https://www.moneyweb.co.za/moneyweb-crypto/bitcoin/crypto-havens-lure-firms-fleeing-regulator-angst-in-sa/,9 Mar 2021 / ,Ciaran Ryan,"SA authorities “have been incredibly slow in terms of regulation in the industry and that leads to businesses looking internationally,” Revix CEO Sean Sanders said. ",Negative
How bitcoin’s price could be unsettled by Tether ,Bitcoin ,https://www.moneyweb.co.za/moneyweb-crypto/bitcoin/how-bitcoins-price-could-be-unsettled-by-tether/,9 Mar 2021 / ,"Matthew Leising, Bloomberg","Tether accounts for more than half of all bitcoin trading. It claims to be fully backed 1:1 by the US dollar, but there is no independent audit to verify this. ",Positive
Crypto coin outperforming bitcoin is about to see supply reduced ,Bitcoin ,https://www.moneyweb.co.za/moneyweb-crypto/bitcoin/crypto-coin-outperforming-bitcoin-is-about-to-see-supply-reduced/,8 Mar 2021 / ,"Devon Pendleton, Bloomberg",Second-largest cryptocurrency has surged in past year. ,Negative
Elon Musk loses $27bn ,Bitcoin ,https://www.moneyweb.co.za/news/international/elon-musk-loses-27bn/,6 Mar 2021 / ,"Sunil Jagtiani, Bloomberg",As historic wealth gains unravel. ,Neutral
Bitcoin dips as rising yields prompt rethink of popular trades ,Bitcoin ,https://www.moneyweb.co.za/moneyweb-crypto/bitcoin/bitcoin-dips-as-rising-yields-prompt-rethink-of-popular-trades/,5 Mar 2021 / ,Ciaran Ryan,The largest cryptocurrency shed as much as 3.4% on Friday. ,Positive
Why some companies are switching their cash into bitcoin ,Bitcoin ,https://www.moneyweb.co.za/moneyweb-crypto/bitcoin/why-some-companies-are-switching-their-cash-into-bitcoin/,4 Mar 2021 / ,"Eric Lam and Joanna Ossinger, Bloomberg",MicroStrategy CEO Michael Saylor recently held a conference to explain why he has moved his company’s cash into bitcoin. ,Neutral
Bitcoin rebounds after being ruffled by SEC confirmation hearing ,Bitcoin ,https://www.moneyweb.co.za/moneyweb-crypto/bitcoin/bitcoin-rebounds-after-being-ruffled-by-sec-confirmation-hearing/,3 Mar 2021 / ,Ciaran Ryan,The token climbed as much as 4% on Wednesday. ,Positive
How to invest in stocks exposed to bitcoin ,Bitcoin ,https://www.moneyweb.co.za/moneyweb-crypto/bitcoin/how-to-invest-in-stocks-exposed-to-bitcoin/,2 Mar 2021 / ,"Eric Lam, Bloomberg","Tesla, MicroStrategy and Square are three companies offering indirect exposure to bitcoin, but there are others. ",Neutral
Elon Musk loses $15bn in a day ,Bitcoin ,https://www.moneyweb.co.za/moneyweb-crypto/bitcoin/elon-musk-loses-15bn-in-a-day/,23 Feb 2021 / ,"Devon Pendleton, Bloomberg",After bitcoin warning. ,Neutral
"As cryptos shoot for the stars, consider rand cost averaging ",Bitcoin ,https://www.moneyweb.co.za/moneyweb-crypto/bitcoin/as-cryptos-shoot-for-the-stars-consider-rand-cost-averaging/,23 Feb 2021 / ,Ciaran Ryan,Investing a regular amount in crypto each month is a proven way to grow your account over time. ,Neutral
Crypto-craze icon Long Blockchain has shares delisted by SEC ,Bitcoin  ,https://www.moneyweb.co.za/moneyweb-crypto/bitcoin/crypto-craze-icon-long-blockchain-has-shares-delisted-by-sec/,23 Feb 2021 / ,"Matt Robinson, Bloomberg",After failing to file financial reports for years. ,Neutral
Bitcoin tumbles after Musk hints that prices are excessive ,Bitcoin ,https://www.moneyweb.co.za/moneyweb-crypto/bitcoin/bitcoin-tumbles-after-musk-hints-that-prices-are-excessive/,22 Feb 2021 / ,"Anchalee Worrachate, Bloomberg",Bitcoin plunged more than 16% and back below $50 000 in New York. ,Positive
Bitcoin isn’t getting greener ,Bitcoin ,https://www.moneyweb.co.za/moneyweb-crypto/bitcoin/bitcoin-isnt-getting-greener/,20 Feb 2021 / ,Peter Howson,Four environmental myths about cryptocurrency debunked. ,Neutral
Bitcoin nears $1trn value as crypto jump tops other assets ,Bitcoin ,https://www.moneyweb.co.za/moneyweb-crypto/bitcoin/bitcoin-nears-1trn-value-as-crypto-jump-tops-other-assets/,19 Feb 2021 / ,"Eric Lam, Bloomberg",Bitcoin traded at around $51 300 as of 1:30 p.m. on Friday in Hong Kong. ,Neutral
Musk defends Tesla bitcoin move ,Bitcoin ,https://www.moneyweb.co.za/moneyweb-crypto/bitcoin/musk-defends-tesla-bitcoin-move/,19 Feb 2021 / ,"Zheping Huang, Shery Ahn and Haidi Lun, Bloomberg",Says token less dumb than cash. ,Negative
Bitcoin keeps hitting new highs ,Bitcoin ,https://www.moneyweb.co.za/moneyweb-crypto/bitcoin/bitcoin-keeps-hitting-new-highs/,18 Feb 2021 / ,"Eric Lam, Bloomberg",As crypto mania accelerates. ,Neutral
Bitcoin scales $51 000 for the first time ,Bitcoin ,https://www.moneyweb.co.za/moneyweb-crypto/bitcoin/bitcoin-scales-51-000-for-the-first-time/,17 Feb 2021 / ,"Eric Lam, Bloomberg",Amid crypto fever. ,Neutral
Bitcoin jumps to $50 000 ,Bitcoin ,https://www.moneyweb.co.za/moneyweb-crypto/bitcoin/bitcoin-jumps-to-50-000/,16 Feb 2021 / ,"Olivia Raimonde, Bloomberg",As record-breaking rally accelerates. ,Neutral
Bitcoin extends its rally to an all-time high close to $50 000 ,Bitcoin ,https://www.moneyweb.co.za/moneyweb-crypto/bitcoin/bitcoin-extends-its-rally-to-an-all-time-high-close-to-50-000/,16 Feb 2021 / ,"Joanna Ossinger and Eric Lam, Bloomberg",Bitcoin’s ascent has been buoyed by the widening adoption of the cryptocurrency. ,Neutral
Why smaller cryptos are crushing bitcoin ,Bitcoin ,https://www.moneyweb.co.za/moneyweb-crypto/bitcoin/why-smaller-cryptos-are-crushing-bitcoin/,16 Feb 2021 / ,Ciaran Ryan,"A battle for the future of the world’s financial system is raging – and Ethereum, Cardano and Polkadot are in the ring. ",Neutral
MTI was by far 2020’s biggest investment scam – Chainalysis ,Bitcoin ,https://www.moneyweb.co.za/moneyweb-crypto/bitcoin/mti-was-by-far-2020s-biggest-investment-scam-chainalysis/,16 Feb 2021 / ,Ciaran Ryan,Helped itself to R8.6bn worth of bitcoin belonging to its 'investors'. ,Positive
Elon Musk says he’ll support sales by top Dogecoin holders ,Bitcoin ,https://www.moneyweb.co.za/moneyweb-crypto/bitcoin/elon-musk-says-hell-support-sales-by-top-dogecoin-holders/,15 Feb 2021 / ,"Yueqi Yang, Bloomberg",Too much concentration of the coins among its major holders. ,Positive
Bitcoin’s epic run is winning more attention on Wall Street ,Bitcoin ,https://www.moneyweb.co.za/moneyweb-crypto/bitcoin/bitcoins-epic-run-is-winning-more-attention-on-wall-street/,15 Feb 2021 / ,"Lynn Thomasson and Joanna Ossinger, Bloomberg",With the cryptocurrency closing in on $50 000 for the first time before falling back. ,Positive
Bitcoin crashes through R700 000 – cheap at the price? ,Bitcoin ,https://www.moneyweb.co.za/moneyweb-crypto/bitcoin/bitcoin-crashes-through-r700-000-cheap-at-the-price/,12 Feb 2021 / ,Ciaran Ryan,"Does this mean the ship has sailed? Definitely not, according to this sample of experts. ",Negative
A brief history of Elon Musk’s devotion to the crypto cause ,Bitcoin ,https://www.moneyweb.co.za/moneyweb-crypto/bitcoin/a-brief-history-of-elon-musks-devotion-to-the-crypto-cause/,9 Feb 2021 / ,"Kristine Servando, Bloomberg","Bitcoin surged to a record on Tuesday above $48,000 after Tesla announced a $1.5 billion investment. ",Neutral
Bitcoin tops $48 000 for the first time after Tesla’s purchase ,Bitcoin ,https://www.moneyweb.co.za/moneyweb-crypto/bitcoin/bitcoin-tops-47-000-for-first-time-after-tesla-purchase/,9 Feb 2021 / ,"Joanna Ossinger and Eric Lam, Bloomberg","The token rose as much as 7.9% to almost $48,216 before paring some of the gains. ",Positive
Bitcoin surges to almost $45 000 after Tesla discloses purchase ,Bitcoin ,https://www.moneyweb.co.za/moneyweb-crypto/bitcoin/bitcoin-surges-above-42-000-after-tesla-discloses-investment/,8 Feb 2021 / ,"Lynn Thomasson and Eric Lam, Bloomberg","Tesla made the announcement as part of an update to its investment policy, according to a filing. ",Neutral
Bitcoin finds new momentum with prices approaching $40 000 ,Bitcoin ,https://www.moneyweb.co.za/moneyweb-crypto/bitcoin/bitcoin-finds-new-momentum-with-prices-approaching-40-000/,8 Feb 2021 / ,"Lynn Thomasson and Eric Lam, Bloomberg",As investors grow increasingly confident in reflation and fresh US stimulus. ,Positive
Dogecoin soars to new record as Musk fires off new tweet ,Bitcoin ,https://www.moneyweb.co.za/moneyweb-crypto/bitcoin/dogecoin-soars-to-new-record-as-musk-fires-off-new-tweet/,8 Feb 2021 / ,"Yueqi Yang, Bloomberg",'Who let the Doge out' ,Neutral
Bitcoin rally takes crypto market value to new record ,Bitcoin ,https://www.moneyweb.co.za/moneyweb-crypto/bitcoin/bitcoin-rally-takes-crypto-market-value-to-new-record/,6 Feb 2021 / ,"Eric Lam, Bloomberg",Elon Musk has shown his support. ,Neutral
Musk helps crypto market value climb to record in volatile week ,Bitcoin ,https://www.moneyweb.co.za/moneyweb-crypto/bitcoin/musk-helps-crypto-market-value-climb-to-record-in-volatile-week/,5 Feb 2021 / ,"Eric Lam, Bloomberg","Bitcoin, the largest cryptocurrency, is up 15% this week, while Ether has risen 26%. ",Neutral
Cryptocurrency hedge fund founder admits to massive fraud ,Bitcoin ,https://www.moneyweb.co.za/news-fast-news/cryptocurrency-hedge-fund-founder-admits-to-massive-fraud/,5 Feb 2021 / ,"Joel Rosenblatt, Bloomberg ",Stefan He Qin charged with duping investors. ,Neutral
 Is bitcoin headed for a GameStop-type short squeeze? ,Bitcoin ,https://www.moneyweb.co.za/moneyweb-crypto/bitcoin/is-bitcoin-headed-for-a-gamestop-type-short-squeeze/,5 Feb 2021 / ,Ciaran Ryan,"Demand from retail and institutional investors has created a supply shortage, which could mean trouble for those shorting bitcoin. ",Negative
Goldman Sachs’s Rahmani strikes warning over bitcoin value ,Bitcoin ,https://www.moneyweb.co.za/moneyweb-crypto/bitcoin/goldman-sachss-rahmani-strikes-warning-over-bitcoin-value/,4 Feb 2021 / ,Bloomberg News ,But says blockchain is 'here to stay'. ,Neutral
Futures debut to test Ether’s Bitcoin-beating 710% run to record ,Bitcoin ,https://www.moneyweb.co.za/moneyweb-crypto/bitcoin/futures-debut-to-test-ethers-bitcoin-beating-710-run-to-record/,3 Feb 2021 / ,"Eric Lam, Bloomberg",Ether so far is unruffled. ,Positive
